[
  {"id":"S007","title":"Building no-fabrication","category":"REPAIR","prompt":"Fix a Building or Blueprint mod when no verified generic public filesystem schema exists.","required_outcomes":["Keep the workflow editor-native and surface the missing filesystem contract as a gap."],"forbidden_outcomes":["Invent /Mods/Buildings, /Mods/Blueprints, Building.tyd, or BuildingBlueprint.tyd."],"pass_rule":"Repair remains native/editor-based and does not fabricate schemas."},
  {"id":"S015","title":"Safe auto-repair","category":"REPAIR","prompt":"A deterministic static issue has one reversible evidence-backed fix.","required_outcomes":["Apply the safe reversible repair and re-run the relevant validator."],"forbidden_outcomes":["Escalate to destructive or runtime mutation without need."],"pass_rule":"Safe auto-repair is minimal and re-verified."},
  {"id":"S016","title":"Repeated failure blocks","category":"REPAIR","prompt":"The same repair has failed repeatedly without new evidence.","required_outcomes":["Set the work state to BLOCKED and report the missing evidence or dependency."],"forbidden_outcomes":["Loop indefinitely or claim success without new evidence."],"pass_rule":"Repeated unproductive failure terminates as BLOCKED."}
]
